Tidstämpel,Vilka är ni?,Var finns ni? (Har ni lokal?),Hur stor yta har era lokaler?,Hur länge har ni funnits till?,Hur kom ni till?,Hur många medlemmar har ni?,Vilken access har medlemmarna till er (eventuella) lokal?,Vilka skulle du säga är era medlemmar? (Är det något som karakteriserar dem?),Hur drivs ert makerspace? Förening/kommunprojekt/annat?,Om annat...,Hur finansieras ert makerspace?,Om annan finansiering...,Hur mycket?,Vad är tidsperspektivet för er verksamhet? Hur länge ska ni vara verksamma?,"Om ""under projektets varaktighet""","Om ""annat""",Vad har ni för utgifter i verksamheten?,Övrig info om utgifter,Har ni någon annan verksamhet i lokalerna,Är någon av verksamheterna öppna för allmänheten? T.ex. öppna hus...,Vad för verksamheter?,Har ni förvaringsutrymme som är till för deltagares projekt?,Om annat,Hur ser tillgängligheten ut i era lokaler? Är den åtkomlig för dem med funktionshinder? ,Om delvis,Utgår ni från diskrimineringsgrunderna på något sätt i er verksamhet?,Om annat,"Utför ni något arbete med sociala frågor i verksamheten? Till exempel diskriminering, jämställdhet, inkluderande kultur/miljö?","Om ja, vad?","Om nej, varför?",Om annat...,Vad har ni för styrning?,Om annan,Vad har ni för styrelseform?,Om annan,Har ni några anställda?,Om annat,Vem tar ansvar för verksamheten i praktiken?,Vet du om det varit några arbetssökande eller sjukskrivna som sysselsatt sig i er verksamhet?,Har ni i verksamheten sökt samhälleligt stöd för att sysselsätta dem eller undersökt möjligheterna för det?,"Om ""...undersökt..."" varför?",Om annat,Fick ni stöd?,"Mer info (om ja, om nej, om annat)",Vad har ni för verksamhetsrum/verkstäder?,Om annat,Behöver deltagare i verksamheten kvalifikationer för att använda någon av er utrustning?,Om annat,Har ni utbildning i specifik utrustning?,Om annat,"Har ni workshops/kurser i några tekniker? Hård- eller mjukvarutillämpningar, gjutning, tryck mm...",Om annat,Skulle du säga att er verksamhet har en kunskapsdelande kultur?,Mer info för ovanstående alternativ,Tillhandahåller verksamheten några material åt deltagarna?,"Mer info (gratismaterial, försäljning, etc..)",Hur många aktiva deltagare har ni haft den senaste månaden?,Hur många deltagare/medlemmar har ni totalt?,"Har ni deltagit i externa events (mässor, hackathons, mm...)","Om ja, hur många?","Om nej, varför?",Vet du om några företag som har tagit sin början i er verksamhet? T.ex. med prototyptillverkning,"Om ja, hur många?","Om nej, varför?",Om annat,Känner du till någon annan verksamhet som vi borde tala med?,Har er verksamhet kontakt/samarbete med någon annan liknande verksamhet (makerspace)?,Mer info,Lista över kontakter (sociogramdata),Vad har ni haft för problem med verksamheten?,Vad har ni för ambitioner med verksamheten?,Har ni några särskilda framgångar du vill berätta om?,Vill ni vara med i en eventuell riksorganisation för makersverige?,"Mer info (om nej, varför/annat...",Vad vill ni isf ha ut av en sådan riksorganisation?,Är det något som jag inte frågat om som du tycker att jag borde ha
2016-11-03 18.18.05,Luleå Makerspace,"Kyrkogatan 2, Luleå",86 m2 helt våra + 150 m2 som vi kan boka av studiefrämjandet. Konferensrum och kök.,"3år, men lokal endast 1år. tidigare nomadisk verksamhet på bl.a. universitet.","För att väcka ungas intresse för teknik. Facebook delade ut pengar i ett ""community outreach program"" och bildade föreningen för kunna fortsätta med makeraktiviteter riktade mot unga i samarbete med teknikens hus (science center). ",ca 160 (10 ggr så stora som sthlm spc per capita),,Mycket familjer. Föräldrar med barn. ca 1/2. 37% kvinnor.,,ideel förening,"Medlemsavgifter, Kommunala bidrag, Annat","Medlemsavgifter: 200/vuxen/år inkl. barn. Kommunalt: 210 000/år i 3 år. Hittills sökta bidrag från fb varje år 50-75 000. (50, 60, 75).",,Tills vidare,,,"Hyra, Utrustning, Förbrukningsmaterial, Fika",,"Unga makers (Vinnova), 50/50% könsfördelning 10-18 år (10-17). Realisera egna idéer, blinkande rullskridskor mugg med vätskenivåigenkänning. idé-prototyp-fungerande pryl. Delar lokal med studiefrämjandet.",Ja,,Ja,Bokhylla för projekt,Delvis,rullstolstillgänglig,Ja,"Stadgarna är inklusivt formulerade, jobbar för att vara öppna för alla. Nysvenskar kan kommunicera genom teknik i brist på gemensamma språk. Projekt på g med länsstyrelsen ""norrbotten creative lab"" för intergrering via makerrörelsen.",Ja,"könsjämställdhet i teknikvärlden,  Makertjej och MakeHer, tidigare makermamma",,,Styrelse,5 pers styrelse,Operativ (Hands on och centraliserad i beslutsfrågor),Dock med konsultation av sk medlemsmöten angående önskemål om inköp mm... Eldsjälsdriven.,Nej,,"Styrelsen, i viss mån en mindre grupp de som vill hålla lokalen öppen. Datum med framförhållning ger bättre resultat i deltagande.",Ja,,,Känner till möjligheter men det passade inte i.o.m tidsåtgången i byråkratisk process och utbildning samt handledning,,,"Elektronik (lödstation mm...), Prototypning (3D-printing, laserskärare, cnc mm...), Textil, Robotarmar",Cricut. Ingen cnc. Mest elektronik.,Nej,Men brodyrmaskinen hålls inlåst och hanteras av dem som kan hantera den. Iom att barn är där oxå. Det beror oxå på övervakning av öppethållare.,Workshops,Kunskapsutveckling men inte kunskapskrav.,Ja,,Ja,Både formella workshops och informella spontana kollaborationer oxå över generationsgränser.,Ja,"filament till mindre prints, till större får en köpa eget. mindre elektrokomponenter, kablage. limstift. fika.",vet ej,,Ja,"kommer info. ett stort var 3d-skrivar meetup, 500 pers.",,Nej,,"Nej, verksamheten är inte så utvecklad än. Men har inspirerat inkubatorer i Luleå att prototypa med 3d-printning.",,LTU makerspace. Miriam Josbrant. Science centers.,Ja,"gemenskapen Makers of Norrland. Sundsvall, Umeå, Skellefteå, Luleå, Övertårneå. Pajala, Kiruna in the making. Fabriken. ",Stockholm Makerspace,Aktivera folk att ta ansvar för aktiviteter. Finansiering. Låssituationen. Hur hantera avundsjuka pga att vissa får betalt inom externa projekt från t.ex. Vinnova.,"Norrbotten creative lab, integrationsprojekt. Även för att främja entrepenörsskap och jämställdhet genom att tillgängliggöra produktions- och prototypingmedlen i mindre formella kontakter och mer kollaborativa sådana. Samt att inspirera kommuner i Norrbotten att bygga liknande verksamheter.",Jämställdhetsarbetet med Makertjej och MakeHer. Också influenser därifrån på politiker i Norrbotten. Näringslivets pris för årets IT-Norrbottning 2015 för arbetet med inklusion av unga och kvinnor. Dotterns pris året nytänkare 2016. ,Ja,,"Att bli representerad som förening och få ett forum för meningsutbyte, hjälp, samarbete kring svårigheter i drift. Kulturdiskussion om inriktning space/fablab och konkurrens däremellan. Hjälp med bidrag från Vinnova. Legitimitet oxå i bidragsansökningar där riksorganisation krävs. Rak demokrati och ekonomiskt ansvar (en röst per förening, ingen detaljstyrning ovanifrån, ingen proportionerlig betalning efter medlemsantal).","Tillgång till verksamheten: öppettider 3-4ggr/vecka, makerfriday för familjer. öppna verksamheter: workshops på tema, öppet hus. "
2016-11-04 10.27.39,Uppsala makerspace,"Bergsbrunnag 1, Folkuniversitets källare. Enligt muntligt avtal skall spacet hålla studiecirklar.",80-100 m2,"2år, 2mån med lokal","En grupp på 4 grundare tog initiativ utifrån en fb-grupp som redan fanns, växte till 12 på tre möten. Berättelse finns på mailen. 247 på fb-gruppen. 143 i google-grupp maillistan.","36 betalande medlemmar, kommer förmodligen bli fler då medlemsskap inte krävts för att delta på gemensamma dagar.","Labbmedlemmar är registrerade på ett danalock med bluetooth på tfn och kan komma in till ca 7-21.30, till vidare. Grind hos folkuniversitetet stängs, utreds om det blir ändring och access 24/7.",iafa 200-250 makers i grupperna på sociala media. i huvudsak män 20-40 är aktiva på spacet just nu.,Förening,Ideell förening,"Medlemsavgifter, Kommunala bidrag",,"50 000 verksamhetsbidrag i år, vuxna 200/år, rabatterad 100, 300/familj/år, möbler och verkygsdonationer",Tills vidare,,,"Hyra, Utrustning",Hyra är ännu inte satt men blir förmodligen ca 2000/mån.,,Ja,"2ggr/vecka hittills, men kommer bli bara för årsmedlemmar 1gång/vecka och labbmedlemmar 1 gång/vecka. IoT-projekt gemensamt som pengar ska sökas fr kommunen för.",Ja,,Nej,,Inklusiv ambition,I stadgarna står att föreningen ska vara öppen för alla och inget medlemsavtal men formulerar en labbmedlemmar gällande gott uppförande. Stadgarna slår fast att avstängning kan ske om medlem motverkar eller skadar föreningen och dess syfte.,sondering av lokal makertjejgrupp,,medlemsunderlaget är än så länge för smalt för att tidigare sonderingar ska ha haft framgång,,Styrelse,,Operativ (Hands on och centraliserad i beslutsfrågor),,Nej,,"Styrelsen, några som kan få ansvar för olika rum i lokalen. En person har ansvar för IoT-projektet",Ja,Nej,,,,,"Elektronik (lödstation mm...), Trä",,Nej,,Nej,,Ja,"I arduino, papperskonst mm... finns info på www",Ja,Både formellt i workshops och delande av medlemsprojekt på hemsida och informellt,Ja,"Gratis trä, papper... metall tyg plastfilament framöver",,,Ja,"Mässa, makerfaire, LAN-party 2ggr, stadsskogens dag, sci-fest, kulturnatten",,Nej,,,,Knivsta?,Ja,,Stockholm Makerspace,"Hitta lokal. 6 prospekt föll igenom. Ekonomi och byråkrati i ansökningar. De 7 i styrelsen har heltidsjobb, förutom en pensionär som är ännu upptagnare. Ett par, tre i styrelsen gör det mesta. Folk tar uppdrag och försvinner sedan.",Växa och skaffa någon anställd. Bred bas medlemmar med många intressen och diversifierad grupp.,"Bara att få ihop lokal och medlemmar och en förening. IoT-projektet, ljudinstallation. Mumlande låda, röstsyntetisering av olika data i stan som änder i ån, cyklar över bron över den, luftföroreningar. Inspelning, uppspelning och röst upp/ned. Oftare uppspelning av populära klipp.",Ja,,"Riktlinjer och hjälp med t.ex. försäkringar, medlemsavtal, modeller för finansiering. Statistik över de olika kategorier av makerspaces indelat i vilken finansiering de har. Underlag för att använda sig av gentemot politiker. Samarbeten och underlag för aktiviteter. Redogörelse för positionering och flöde av medlemmar mellan traditionella föreningar (t.ex. slöjdföreningar) och makerspaces. Överlappning, övertag, de andra föreningarnas struktur och en inventering av dem. Relationen mellan spaces och studieförbund, för och nackdelar med relationen.",
2016-11-10 19.48.05,Mikrofabriken,"Frihamnen 5, Göteborg",ca 145kvm,1år 8mån,"Genom saknad av Chalmers makerspace för studenter, personligen, och genom fb-gruppen ""Jag saknar en verkstad"" som sedan kallade till möte där föreningen fick sin början.",19,"Alla har egen nyckel, nästa år rfid-brickor, 24/7","Filterbubblan på fb har gjort att det bara är civilingenjörer, fr början 10 ex:ade. Nätverket sprids genom deras arbetsplatser, men fotfäste växer utanför filterbubblan. Medlemmar väljs in på basis av möte där föreningen under öppna hus och i chatt på nätet utvärderar personens karaktär, trevlighet och vilja att utveckla föreningen (som en basist i ett band) på basis av social kompatibilitet. Samt förmåga att avgöra vilka maskiner den kan köra utan att ha sönder dem och göra sig illa samt kompetens att köra alla maskiner som den vill. Föreningens mål har varit att ingen ska känna sig obekväm med att vara i lokalen, oxå pga den höga ekonomiska uppställningen. Målet är att alla ska vara kompisar.",Förening,Ideell förening,"Medlemsavgifter, Engångsavgifter",,"Månadsavgift 800kr täcker löpande kostnader som förbrukningsmaterial, hyra, el, mm... Maskininvesteringar täcks genom att medlemmarna lånar en insats på kvarts prisbasbelopp till föreningen.""Insatsmedlemmar"" är de enda med rösträtt. Icke insatsmedlemmar betalar 950kr/mån. Anton vill att icke insatsmedlemmar ska betala dubbelt så mycket som insatsmedlemmar. Vid utträde får medlemmar tillbaka insats, när en ny insatsmedlem blir medlem. Om ingen står på inträdeslistan så får föreningen sälja en maskin för att täcka utträdeskostnad. Tillbakabetalning är inflationskompenserad.",Tills vidare,"Att skala upp en stabil verksamhet, som har likviditet nog att betala tillbaka insats utan att få från ny medlem",,"Hyra, Utrustning, Förbrukningsmaterial, AW- aktiviteter; fika, mat",,"En konstnär, Filippa, gör muraler på väggarna i lokalen och får svetskurs för sig och 2 vänner i utbyte.",Ja,"Varje måndag, då det också är underhåll och uppbyggande av verksamheten genom rivning och bygge. Vid de tillfällena får också besökare ta med något projekt att göra i lokalen med maskiner.",Ja,"Två 40-fotscontainrar som står utanför lokalen med europallar. 10 000/3 000 kr resp. Ena är medlemsförvaring där medlemmar kan en Europall för 50kr/mån. Den andra är till för förvaring av förbrukningsmaterial och korttidsförvaring (4 veckor) utan hyra. Projekten kan vara mycket stora, t.ex en 1,2 tons 8-personscykel.",Delvis,Huvuddelen av lokalen är i markplan men har ett loft på 45kvm utan handikapp-access. Det kan dock byggas dit. Toaletten är inte HWC.,Ja,"I reglementet, inte stadgarna, finns uppförandepolicy som medlemmar får när de går med står att diskriminering inte får ske på dessa grunder. Medlemmar får inte skada föreningens rykte eller syfte, vilket är grund för uteslutning. Annan grund är att skada sig eller andra vid maskinerna.",Analys och förberedelse,,Kontakter med tex queerhack har inte blivit av pga tidsbrist,Letande efter kvinnor som kan vilja vara med. Analys av statistik säger att det vid det här laget i utvecklingen borde vara fler kvinnliga medlemmar på Mikrofabriken. Det är ett problem att det måste finnas fler för att komma fler. Diskussion förs med Makertjej för att utveckla arbete och analys av hur kvinnor bemöts när de kommer på öppna hus. Övervägande av att öppna av vissa dagar för separatistisk verksamhet. Självrannsakning av marknadsföring och jargong.,Styrelse,Med medlemmar med och utan rösträtt.,Bokförande styrelse,"Gör det möjligt  för föreningen, att genom sanktionering (som regel på styrelse möten i efterhand), att göra som den vill genom inofficiell sanktionering i ""hive-mind"" på chatt, där även medlemsprospekt deltar. Mikrofabriken styrs genom ""you do, you decide"". Så länge du tar ansvar för det så får du genomföra t.ex maskininköp och modifiering av maskiner. Vädrade åsikter tas i beaktning om den med dem deltar, också medlemsprospekt.",Nej,,"""You do, you decide""",Nej,Nej,,,,,"Trä, Metall, Textil, Mindre mekanisk verkstad","Entry level legomekanisk tillverkningsverkstad. CNC, 3,5ton, svets, svarv, handjagad fräs, industrisymaskin. Målarbås och elektronikverkstad ska tillkomma. Verksamheten är väldigt fri att utvecklas av medlemmar själva. Också icke insatsmedlemmar kan ställa dit maskiner, förutsatt att den är tillgänglig för alla vilket kan, om det sanktioneras inofficiellt/officiellt av styrelsen.",Ja,Medlemmar får visa vad de kan hantera eller inte.,"Ad hoc, p2p",,Nej,,Ja,,,"Chalmers kortege-kommité donerar stål till föreningen som just nu är gratis men ska förses med symbolisk summa. En medlem har bult-, skruv-, mutterkiosk. Läsk-kiosk finns.",19. En typisk vecka har mer än 50-procentig.,,Ja,"Vetenskapsfestivalen, arrangeras gratis av gbg stad på vetenskapstema på 10-talet platser i göteborg. Mikrofabriken gjorde tillsammans med två medlemmars arbetsgivare ett minimakerspace arduino-programmering och klipp och klistra. Även en utställning av bla potatiskanon.",,Det utförs prototypning nu,Åtminstone 4 med ambitioner att starta företag.,,,"(gbg make, samlingsplats) frilagret, kkv elektro (konstnärernas kollektivverkstad), ",Ja,,Chalmers robotförening,Att folk köper för mycket och för stora maskiner som måste köpas containrar till. Könsfördelningen.,"80 medlemmar, personligen. Stabil verksamhet som inte står och med att medlemmar går ur och in eller att eldsjälar bränns ut.",Högt engagemang från liten skala och att vi växt ur en lokal.,Ja,,Info om hur stor den ideella arbetsgruppen behöver vara för att driva föreningen vid större skala. Vi kommer rulla ut ett eget projekt för medlemssystemet och vill undvika dubbelarbete. Vi behöver informations- och kunskapsutbyte. Vill ha en digital gateway för alla föreningar. Samlat arbete mot Vinnova och statens olika organ för enskilda föreningarna. Konferens årligen!,
2016-11-11 19.10.47,"Tvätteriet, makerspace","Sidsjövägen 7, Sundsvall",400kvm+400kvm källare,"sedan juni, öppet i två veckor","Efter ett långt arbete gentemot Sundsvalls Kommun, Västernorrlands Landsting, Länstyrelsen, Mittuniversitetet. Föddes ur en tanke att en i närregion ska få tillgång till nav med maskinpark för utveckling, tillsammans med företag vars maskintid blir tillgänglig för dem som vill ägna sig åt hobbyverksamhet och produktutveckling. Även för offentlig sektor som Landsting, Försäkringskassan. En plattform för innovation och utvecklingsarbete, öppen för alla och ett nav för privat och offentlig verksamhet såväl som för entrepenörer och hobbyister med samma tillgänglighet som ett bibliotek. Ett samarbete mellan Åkroken science park, Sundsvalls kommun, Länsstyrelsen västernorrland, Mittuniversitetet och Designer västernorrland (liten ideell org verkar för designmognad i regionen).","10-15, håller på att värva.",Öppet hus för medlemmar och medlemsprospekt två dagar i veckan. 8-22 om man har kompetensen för maskinparken. Inte 24/7 pga försäkringskäl.,"Privatpersoner, företagare, uppfinnare. Studenter som arbetar i projektteam mot företag med produkt- och tjänsteutblidningar. Ser på möjlighet med medlemskap som företagsförmån från större företag.",Under aktiebolag,Ligger under Åkroken Science park. Kan bli ideell förening.,"Medlemsavgifter, Kommunala bidrag, Högskolefinansiering, Annat","Maskintid, olika per maskin. Länsstyrelsen västernorrland. Framgent genom Science park",medlemsavgift: Basavgift 200+ månadsavgift 300.,Tills vidare,,,"Hyra, Utrustning, Förbrukningsmaterial, en anställd",,"Seminarieverksamhet, kursverksamhet från bl.a. mittuniversitetet",Ja,Medlemmar får ta med sig andra på besök.,Ja,Källarlokalen på 400kvm är förråd,Delvis,"toaletten, nej. ska anpassas. källaren, nej. allt annat rullstolstillgängligt",Ja,"Ingen förening ännu, men kommer att stå i stadgar att vi är öppna för alla. Hittills policy.",Nej,,Väldigt tidigt i utvecklingen. Har för avsikt att göra det.,,VD och ledning,Styrgrupp med kommunen science park och univestitet,Strategisk (Hands off och delegerande),,Ja,två halvtidsanställda tekniker,De halvtidsanställda,Nej,Nej,,,,,"Elektronik (lödstation mm...), Prototypning (3D-printing, laserskärare, cnc mm...), Trä, Metall, Textil, VR",,,För närvarande avgör det tillgång till lokalen.,Ja,Teknikerna som är anställda ger kurser. Avgifter kommer att appliceras.,Ja,"Eldsjälar i föreningen, t.ex med makertjej, har workshops för kvinnor (det kommer för unga) i elektronik och annat.",För tidigt,Iom att det ska vara företagsverksamhet så kommer det att begränsas. Även andras tillgång kommer begränsas när de hyr in sig för innovationsarbete.,Ja,"filament, elektronikkomponenter till självkostnadspris",,,Nej,,inte hunnit,På gång,,,"Har en som gör elektroniktester. Studenterna, ovan nämnda, 12 st. 15 allt som allt.","Härnösand Teknikus, David gisselman Christina Epsson, science center. Tordab ö-vik komtek. ",Ja,,Teknikus är tänkt samarbetspartner,"Lång startsträcka från opinionbildande arbete till verklighet, finansiering.",Kunna få med annan offentlig verksamhet som kommun och landsting för deras anställda att använda i utveckling av offentlig verksamhet. Att fungera som bro mellan olika delar av offentlig verksamhet och företag för ett organisationsmässigt plattare och mer tvärdisciplinärt arbete.,Att få de olika aktörerna bakom tvätteriet att ställa sig bakom styrgruppen där universitetet och kommun sitter.,Ja,Framöver,"Omvärldsbevakning, komplettera nodal struktur som tvätteriet syftar till att utveckla där andras maskinparker blir tillgängliga inom strukturen.",
2016-11-16 20.50.29,Övertårneå makerspace,"Har inte egen lokal, kommunens lokal på, Skolvägen Övertårneå",Skolans lokaler inräknat är det mkt stort. Föreningens lokal stor nog att köra in en bil i och inhysa metallslöjd och svetsbås.,"2 år, lokal i halvår",Genom skolverksamheten som gjorde en workshopsserie för allmänheten och politiker och tjänstemän från kommunen. Ur det startades föreningen. Barnen gjorde ett virtuellt makerspace i minecraft med många olika verkstäder som förslag till förlaga. Lokalen är den före detta metallslöjdslokalen på skolan. ,"Oklart, info kommer. Iom bidragen är spacet öppet för alla.","Under öppettider. 15-18 vardagar, 12-16 lördagar, extraaktiviteter på söndagar. Öppettiderna kan förlängas vid behov hos medlemmar och allmänhet.","Intresse för skapande, alla har varit tidigare elever på gymnasieskolan där det ligger.",Förening,Ideell förening,"Medlemsavgifter, Kommunala bidrag, Annat","Sparbanken nord, 10 000+7 000; Statliga bidrag för integrationsfrämjande åtgärder via kommunen, 116 000; Privat donation",Medlemsavgifter 20kr/år,Tills vidare,,,"Utrustning, Förbrukningsmaterial, Föreläsare",Förbrukningsmaterial till workshops,gymnasiekolan har också makerspace i lokalerna som har heltidsanställd tekniker och deltidsanställd pedagog. Spacet och skolan delar sina maskinparker med varandra. Öta spc samverkar och resursdelar för att fungera med finansiering och medlemsunderlag.,Ja,Makerspacet har som riktlinje att uppmuntra till skapande och har öppet för alla.,Ja,,Delvis,"Rullstolsramp finns, men ej hwc.",Ja,Stadgarna fastslår att makerspacet ska vara öppet för alla och diskriminering tillåts ej. (samma som luleås),Ja,"Ada Lovelace-dagen firades med aktiviteter och workshops för kvinnor. Utvärdering hos åk2 på gymn vilka skapande verksamheter de är intresserade av att ha på makerspace. Integrationsfrämjande arbete mot entrepenörskap, med bl.a. föreläsningar, hos unga och verksamhet riktad HVB-hemmen i regionen. Samarbete även med ung företagsamhet-""företag"" på gymnasieskolan som också riktar sig till nyanlända på förberedande individuella program. Föreningen köper tjänster från UF-företagen för att hålla i aktiviteter på spacet. Rädda barnen har aktivitet på barnkonventionens dag med barnkalas och pyssel.",,,Styrelse,Nästan alla i föreningen är med i styrelsen,Strategisk (Hands off och delegerande),"I en bredare mening, med delegering med ekonomiska medel.",Nej,,"Styrelsemedlemmar, medlemmar. Eldsjälar som varit med och startat föreningen hjälper till att utveckla.",Ja,Nej,,,,,"Elektronik (lödstation mm...), Prototypning (3D-printing, laserskärare, cnc mm...), Trä, Metall, Textil, Målning","Hemkunskapssal, svetsbås, VR-utrustning, liten knivplotter, textilvärmetryckpress, -ingen cnc/laserskärare, film- & fotostudio planeras, glasugn undersökes, även bearbetning av silverlera",Ja,,Nej,Kommer att komma kurser i t.ex. värmepressen,Ja,,Ja,"Samarbetet med skolan gör att det kommer finnas tillgång en gemensam digital plattform med intruktioner på spacets hemsida. Plattformen utformas av pedagog som är deltidsanställd på skolans makerspace. Alla hjälps åt i den vardagliga verksamheten, även restmaterial som köpts in av medlemmar privat delas med alla.",Ja,Både gratis workshopmaterial och förbrukningsmaterial som plastfilament.,ca 70,,Ja,Framtid Tårnedalen (mässa) i fjol och kommer vara med i år,,Ja,UF-företagen nyttjar lokalerna även utanför skoltid för produktutveckling. Det är t.ex. från wordpress-instruktioner till robotutveckilng.,,,,Ja,,Luleå Makerspace,Det har tagit längre tid och kraft än det ibland finns att ta av. Lokalens färdigställande tog tid.,"Utvidga samarbetet med fler organisationer, föreningar i området i bl.a. integration. Att starta projekt med kodning och spelutveckling. Att få fler sponsorer, lokala sponsorer. Att få bussar på lördagar som matchar aktivitet på makerspace går in till Övertårneå.","Att vi bildades! Att integrationsprojektet för integration, skapande och entrepenörsskap blev till.",Ja,,"Villkorat med acceptans för den lokala karaktären och samarbetena som är förutsättning för lokala förhållande. Vi behöver kunskapsdelning som kursupplägg, såväl som hjälp med ekonomiska medel. Även legitimering och lobbande. Utarbetning av centraliserad certifieringsprocess för olika maskiner som gäller nationellt.",
